{
  "$schema": "https://json-schema.org/draft/2020-12/schema",
  "title": "TPL-001.A PROPOSAL snapshot v1",
  "type": "object",
  "additionalProperties": false,
  "required": [
    "schema_version",
    "composition",
    "content",
    "presentation",
    "customization",
    "experience"
  ],
  "properties": {
    "schema_version": {
      "const": 1
    },
    "composition": {
      "$ref": "composition.v1.json"
    },
    "content": {
      "$ref": "content.v1.json"
    },
    "presentation": {
      "$ref": "presentation.v1.json"
    },
    "customization": {
      "$ref": "customization.v1.json"
    },
    "experience": {
      "type": "null"
    }
  }
}
