{
  "schema_version": 1,
  "composition": {
    "schema_version": 1,
    "template": {
      "id": "editorial",
      "version": "1.0.0"
    },
    "layout": "editorial-grid",
    "sections": [
      {
        "id": "hero",
        "type": "hero",
        "variant": "hero-split",
        "visible": true,
        "required": true,
        "toggleable": false,
        "reorderable": false,
        "presentation_policy": {
          "spacing": [
            "compact",
            "normal",
            "airy"
          ],
          "alignment": [
            "start"
          ],
          "emphasis": [
            "quiet",
            "strong"
          ]
        }
      },
      {
        "id": "about",
        "type": "about",
        "variant": "about-column",
        "visible": true,
        "required": false,
        "toggleable": true,
        "reorderable": true,
        "presentation_policy": {
          "spacing": [
            "compact",
            "normal",
            "airy"
          ],
          "alignment": [
            "start"
          ],
          "emphasis": [
            "quiet",
            "strong"
          ]
        }
      },
      {
        "id": "skills",
        "type": "skills",
        "variant": "skills-sidebar",
        "visible": true,
        "required": false,
        "toggleable": true,
        "reorderable": true,
        "presentation_policy": {
          "spacing": [
            "compact",
            "normal",
            "airy"
          ],
          "alignment": [
            "start"
          ],
          "emphasis": [
            "quiet",
            "strong"
          ]
        }
      },
      {
        "id": "projects",
        "type": "projects",
        "variant": "projects-featured",
        "visible": true,
        "required": false,
        "toggleable": true,
        "reorderable": true,
        "presentation_policy": {
          "spacing": [
            "compact",
            "normal",
            "airy"
          ],
          "alignment": [
            "start"
          ],
          "emphasis": [
            "quiet",
            "strong"
          ]
        }
      },
      {
        "id": "contact",
        "type": "contact",
        "variant": "contact-panel",
        "visible": true,
        "required": false,
        "toggleable": true,
        "reorderable": false,
        "presentation_policy": {
          "spacing": [
            "compact",
            "normal",
            "airy"
          ],
          "alignment": [
            "start"
          ],
          "emphasis": [
            "quiet",
            "strong"
          ]
        }
      }
    ]
  },
  "content": {
    "schema_version": 1,
    "sections": [
      {
        "section_id": "hero",
        "type": "hero",
        "data": {
          "title": "Designer UX/UI — profil de démonstration",
          "subtitle": "Des expériences claires, accessibles et utiles.",
          "cta_label": "Découvrir mes études de cas"
        }
      },
      {
        "section_id": "about",
        "type": "about",
        "data": {
          "heading": "Ma démarche",
          "body": "Recherche, exploration et itérations : texte synthétique à personnaliser."
        }
      },
      {
        "section_id": "skills",
        "type": "skills",
        "data": {
          "heading": "Compétences",
          "items": [
            "Recherche utilisateur",
            "Design d’interaction",
            "Prototypage"
          ]
        }
      },
      {
        "section_id": "projects",
        "type": "projects",
        "data": {
          "heading": "Études de cas",
          "items": [
            {
              "id": "20000000-0000-4000-8000-000000000001",
              "title": "Service de démonstration",
              "summary": "Étude de cas fictive : compréhension du problème et exploration de solutions.",
              "url": null
            }
          ]
        }
      },
      {
        "section_id": "contact",
        "type": "contact",
        "data": {
          "heading": "Échangeons",
          "body": "Remplacez ce texte par votre invitation.",
          "email": null
        }
      }
    ]
  },
  "presentation": {
    "schema_version": 1,
    "theme": {
      "id": "studio-neutral",
      "version": "1.0.0"
    },
    "sections": [
      {
        "section_id": "hero",
        "settings": {
          "spacing": "airy",
          "alignment": "start",
          "emphasis": "strong"
        }
      },
      {
        "section_id": "about",
        "settings": {
          "spacing": "airy",
          "alignment": "start",
          "emphasis": "quiet"
        }
      },
      {
        "section_id": "skills",
        "settings": {
          "spacing": "airy",
          "alignment": "start",
          "emphasis": "quiet"
        }
      },
      {
        "section_id": "projects",
        "settings": {
          "spacing": "airy",
          "alignment": "start",
          "emphasis": "quiet"
        }
      },
      {
        "section_id": "contact",
        "settings": {
          "spacing": "airy",
          "alignment": "start",
          "emphasis": "quiet"
        }
      }
    ]
  },
  "customization": {
    "schema_version": 1,
    "sections": []
  },
  "experience": null
}
